{"$defs":{"FileEntry":{"additionalProperties":false,"properties":{"annotation_version":{"anyOf":[{"minLength":1,"pattern":"\\S","type":"string"},{"type":"null"}],"default":null,"title":"Annotation Version"},"path":{"minLength":1,"pattern":"\\S","title":"Path","type":"string"},"record_count":{"anyOf":[{"minimum":0,"type":"integer"},{"type":"null"}],"title":"Record Count"},"role":{"enum":["documents","personas","steps","deliveries","exposures","coverage","events","claims","gold","families","source_registry","schema","code","support","baseline_config","observations","event_relations","annotations","adjudications","delivery_items","fixture_expectations","event_alignments","support_reviews"],"title":"Role","type":"string"},"sha256":{"pattern":"^[0-9a-f]{64}$","title":"Sha256","type":"string"}},"required":["path","role","sha256","record_count"],"title":"FileEntry","type":"object"},"OriginCounts":{"additionalProperties":false,"properties":{"real":{"minimum":0,"title":"Real","type":"integer"},"synthetic":{"minimum":0,"title":"Synthetic","type":"integer"}},"required":["real","synthetic"],"title":"OriginCounts","type":"object"},"SplitCounts":{"additionalProperties":false,"properties":{"dev":{"minimum":0,"title":"Dev","type":"integer"},"test":{"minimum":0,"title":"Test","type":"integer"},"train":{"minimum":0,"title":"Train","type":"integer"}},"required":["train","dev","test"],"title":"SplitCounts","type":"object"}},"$schema":"https://json-schema.org/draft/2020-12/schema","additionalProperties":false,"properties":{"annotation_version":{"minLength":1,"pattern":"\\S","title":"Annotation Version","type":"string"},"baseline_config_sha256":{"anyOf":[{"pattern":"^[0-9a-f]{64}$","type":"string"},{"type":"null"}],"title":"Baseline Config Sha256"},"created_at":{"format":"date-time","pattern":"^\\d{4}-\\d{2}-\\d{2}T\\d{2}:\\d{2}:\\d{2}(?:\\.\\d{1,6})?(?:Z|[+-]\\d{2}:\\d{2})$","title":"Created At","type":"string"},"dataset_id":{"minLength":1,"pattern":"\\S","title":"Dataset Id","type":"string"},"dataset_revision":{"minLength":1,"pattern":"\\S","title":"Dataset Revision","type":"string"},"family_split_counts":{"$ref":"#/$defs/SplitCounts"},"file_hashes":{"items":{"$ref":"#/$defs/FileEntry"},"minItems":1,"title":"File Hashes","type":"array"},"frozen_at":{"anyOf":[{"format":"date-time","pattern":"^\\d{4}-\\d{2}-\\d{2}T\\d{2}:\\d{2}:\\d{2}(?:\\.\\d{1,6})?(?:Z|[+-]\\d{2}:\\d{2})$","type":"string"},{"type":"null"}],"title":"Frozen At"},"legal_notes":{"minLength":1,"pattern":"\\S","title":"Legal Notes","type":"string"},"limitations":{"items":{"minLength":1,"pattern":"\\S","type":"string"},"minItems":1,"title":"Limitations","type":"array"},"persona_revision":{"minLength":1,"pattern":"\\S","title":"Persona Revision","type":"string"},"record_origin_breakdown":{"$ref":"#/$defs/OriginCounts"},"schema_revision":{"minLength":1,"pattern":"\\S","title":"Schema Revision","type":"string"},"source_registry_sha256":{"pattern":"^[0-9a-f]{64}$","title":"Source Registry Sha256","type":"string"},"split_policy":{"const":"family_locked_v1","title":"Split Policy","type":"string"},"status":{"enum":["draft","frozen","superseded"],"title":"Status","type":"string"}},"required":["dataset_id","dataset_revision","schema_revision","annotation_version","created_at","frozen_at","record_origin_breakdown","file_hashes","source_registry_sha256","persona_revision","split_policy","family_split_counts","baseline_config_sha256","legal_notes","limitations","status"],"title":"Manifest","type":"object"}
