{"annotation_version":"g1a-annotation-v2","baseline_config_sha256":"0c9b57635d14440d89d571f265bb45e6b749a9dff75984f0a5101a6e84642efd","created_at":"2026-10-20T14:43:21.939113+00:00","dataset_id":"g1-pr2-synthetic-pilot","dataset_revision":"pr5-five-trajectories-v10-ai-input-draft","family_split_counts":{"dev":7,"test":0,"train":0},"file_hashes":[{"path":"__init__.py","record_count":null,"role":"code","sha256":"6568187902276548fe6846fbd35d77a5175f69c357886f828df865fbc2bbf675"},{"path":"acceptance.py","record_count":null,"role":"code","sha256":"103fa72e636d995e4600fb172cc9b78e187834b45b47ed028087b7f453536c7a"},{"path":"agreement.py","record_count":null,"role":"code","sha256":"7d7bf15a45ca67efc1e96dad1be9a4a3c6846b129a2aad9f6c9133fef96a7460"},{"path":"ai_development.py","record_count":null,"role":"code","sha256":"4e52c8cbf6eb748aa74bb25b45e762847c023c2c5860c850f812985299c3ccfe"},{"path":"ANNOTATION_GUIDE.md","record_count":null,"role":"support","sha256":"2eeaaeec69e7e0206200a86850b4e58401bf58d5f2e39b74557088a78288e5eb"},{"path":"ANNOTATION_GUIDE_AI.md","record_count":null,"role":"support","sha256":"c33e6b14082ac0898a5ff86d7c4e8c1bb58d2884b902fc2596ec635effe1a6e9"},{"path":"ANNOTATION_GUIDE_V2.md","record_count":null,"role":"support","sha256":"6b722d170563f785aae6c1902929ad9c420eaaf4c39dbc6aa46f25ed65b1f0a1"},{"path":"ANNOTATION_GUIDE_V3.md","record_count":null,"role":"support","sha256":"cae5aceb2643720723faf87891ae2d0cf2fa877acdefa819341a9195991cfa7c"},{"path":"annotations.py","record_count":null,"role":"code","sha256":"e235d1d56dc31e1c41df3d52e524ecd6e9abde06cd95a938659e64f46a74c7bd"},{"path":"baselines.py","record_count":null,"role":"code","sha256":"31a6b6ec639635af00d9bf3a6012e950e1d333cda8b280a6115e5ec63f9d8c03"},{"path":"budget.py","record_count":null,"role":"code","sha256":"c9ba1e29f89b5b7653d2ba4ef59023320cd4f7d383f18fc571e94766ff1323a4"},{"path":"build_pr5.py","record_count":null,"role":"code","sha256":"1be91b360f402f8f722f6d40fb6f845ef11c93c9f58dd146fd0e9e0876b2eb23"},{"path":"claims/claims.jsonl","record_count":7,"role":"claims","sha256":"bf3d5002e4b3614b0ca88b13261e1e44b5422e6ec4a9a664cd1c3b7334b79b0f"},{"path":"contracts.py","record_count":null,"role":"code","sha256":"716a30ec7da45f8c95c9098462ec0cae1e8d1b1849895fc8ad62df0793529d64"},{"path":"DATA_CARD.md","record_count":null,"role":"support","sha256":"d60aa480887afabfd909c1223284f80aa1ead1308fbb9d321cc505d0591ca3ad"},{"path":"DATA_DICTIONARY.md","record_count":null,"role":"support","sha256":"e50cc194f58d151989cd4abd3d6f65550c4c5fe69d42d81f7cf0fc0abf3f4d4d"},{"path":"DEV-01/annotation_template.json","record_count":null,"role":"support","sha256":"26609850e86dc452013a36e39479fd76ecb58ee54e34dd8f0a58e7a98c35a8fd"},{"path":"DEV-01/pilot_status.json","record_count":null,"role":"support","sha256":"b3bef88f16e519ca94c02260035d647e9c745af91921d1b2d7af1eac875f93dc"},{"path":"DEV-01/README.md","record_count":null,"role":"support","sha256":"3d974f7e531c8b33992f307ec82454cf4cae534f3afc14d7d4c55d1c963e8c4d"},{"path":"DEV-01/semantic_probe.json","record_count":null,"role":"support","sha256":"ec90d7cb7bb4ab4044bf71fafe1df1cc805198b6e09c5a832d25a7452f1bd48a"},{"path":"DEV-01/visible_versions.json","record_count":null,"role":"support","sha256":"4835c1489b7b201565beda62a14a727f63b253ee25015c3352436beec21d3a88"},{"path":"DEV-02/annotation_template.json","record_count":null,"role":"support","sha256":"130e8c78bd144953968916ce9777cb4dedc877d06307db6d83f4df4964acc992"},{"path":"DEV-02/claims.jsonl","record_count":5,"role":"claims","sha256":"8524d9c535102ec90e69f28b8416505c0b8a1b5fcca2d5bef9fb2b00361adfff"},{"path":"DEV-02/coverage_windows.jsonl","record_count":20,"role":"coverage","sha256":"fc806329ed1ef14aa0819d42969f40729c99ee84ab0b93bf9f7d4ac03f776f08"},{"path":"DEV-02/deliveries.jsonl","record_count":1,"role":"deliveries","sha256":"f897821c7c32538e94c7c1070dc4f62b414e226ac392021bddcac994671beaa5"},{"path":"DEV-02/delivery_items.jsonl","record_count":1,"role":"delivery_items","sha256":"32a8f2a01f7a1cf221a0302420009ae20f5964f4b4a3cc9e1b9d0ce0572c909f"},{"path":"DEV-02/documents.jsonl","record_count":7,"role":"documents","sha256":"3bf5b06f6a57fc35c225e1ac73c7f0a1029968bc565f3224766c6682cb39520c"},{"path":"DEV-02/event_relations.jsonl","record_count":4,"role":"event_relations","sha256":"ff9c04e64374bb85a709a7f20d72173b7acdf02aabb49ef99372fe63c3194603"},{"path":"DEV-02/events.jsonl","record_count":3,"role":"events","sha256":"5ab48468ddde6b568cb5195a6b59121326cb1f115c383eab6d23b725125ef92f"},{"path":"DEV-02/expectations.jsonl","record_count":10,"role":"fixture_expectations","sha256":"d495686ef40b46d107bd1316a631628e35ad6825b78fb038d4e0d71b136237c6"},{"path":"DEV-02/exposures.jsonl","record_count":2,"role":"exposures","sha256":"d68a585349aa48a55a5357c21febef88ac1dae85ef9f9e963535746517d97165"},{"path":"DEV-02/families.jsonl","record_count":1,"role":"families","sha256":"dd6a8845f3d5ee52445e8e402244cd148824ce56994e0366021e370629ef07c2"},{"path":"DEV-02/personas.jsonl","record_count":1,"role":"personas","sha256":"783810547b129c6b24320789853351946a4b5565a92388f9f27227344d606c5d"},{"path":"DEV-02/README.md","record_count":null,"role":"support","sha256":"2992c284ea8fe7f2ce0113fba06750a8f48baa87190a035f95854112960d654e"},{"path":"DEV-02/semantic_probe.json","record_count":null,"role":"support","sha256":"55345595ea491b4b35eb5e0be0110db7e29834e51099ddcac9d697ad887f62a9"},{"path":"DEV-02/steps.jsonl","record_count":5,"role":"steps","sha256":"e9a33d8cd786f43ad88cef0870f449c96db96e13a58265c87d22382dff2610e3"},{"path":"DEV-02/visible_versions.json","record_count":null,"role":"support","sha256":"804974f976937f0427141e031fa384cb307f6a709f17f5ae50f1bcba1926b9d7"},{"path":"DEV-03/annotation_template.json","record_count":null,"role":"support","sha256":"130e8c78bd144953968916ce9777cb4dedc877d06307db6d83f4df4964acc992"},{"path":"DEV-03/claims.jsonl","record_count":5,"role":"claims","sha256":"d366fb1ff2ecac3ceb07f5ef90f9b7596649e8976109ac0ff38a29fdab2f278f"},{"path":"DEV-03/coverage_windows.jsonl","record_count":20,"role":"coverage","sha256":"faa4598632621175d81fe2ef24febfee897c984d1ec1b9305ac25f8db77d9c00"},{"path":"DEV-03/deliveries.jsonl","record_count":1,"role":"deliveries","sha256":"81eeee02a36bcd99d5c732eb72807c1442cd541707f0faf8adbea45d2f552221"},{"path":"DEV-03/delivery_items.jsonl","record_count":1,"role":"delivery_items","sha256":"51f1d5243416febd6b9a02a23b645d6975a4d33973447ab7d38393d16523ae54"},{"path":"DEV-03/documents.jsonl","record_count":7,"role":"documents","sha256":"4ae99dff16a36ebd7d86c9d058e9776c7f09d47c505904f6e743a47952f0529c"},{"path":"DEV-03/event_relations.jsonl","record_count":4,"role":"event_relations","sha256":"eac7cf7df494aed38d69df7db92cb3cdeac3c0fda9c2dfbf434a4b650ccba625"},{"path":"DEV-03/events.jsonl","record_count":3,"role":"events","sha256":"84fb4679e6f82bd4d2c7324eab1861f628d7e247544aa232171575d40a16462a"},{"path":"DEV-03/expectations.jsonl","record_count":10,"role":"fixture_expectations","sha256":"c41ac2049aab3a112e1f079ac4842c941c0d8d80ebf4cee06e00a60d9a8891c6"},{"path":"DEV-03/exposures.jsonl","record_count":2,"role":"exposures","sha256":"b4850623b63bd23e7e938e758bf45dcc50b420e561f495dac015b768dae762cd"},{"path":"DEV-03/families.jsonl","record_count":1,"role":"families","sha256":"2c83380b2761af9483989940cf8a36a35b6199d43f58141861d18957b256f833"},{"path":"DEV-03/personas.jsonl","record_count":1,"role":"personas","sha256":"94c5f9dd1be18260f6c9f30a6841893489536cf30f7385ea17ff1f239e202ccc"},{"path":"DEV-03/README.md","record_count":null,"role":"support","sha256":"8d3f53429a1ed4d2a39f4797db79781d52f8589ab458a7796af3dbfecbc8e91f"},{"path":"DEV-03/semantic_probe.json","record_count":null,"role":"support","sha256":"0d3c4e86f402d2943f0e10dd1ded4c7dc7cfd3c397902055f4d1046dc3f652e6"},{"path":"DEV-03/steps.jsonl","record_count":5,"role":"steps","sha256":"c9966a4bbcfde9b9f52df0b7e380ef5984c115e6e11c0f789a23620190f6181e"},{"path":"DEV-03/visible_versions.json","record_count":null,"role":"support","sha256":"3ef94dda0faac1c75748a439dad041718bf3ca593828ce970e2690b786c0de65"},{"path":"DEV-04/annotation_template.json","record_count":null,"role":"support","sha256":"130e8c78bd144953968916ce9777cb4dedc877d06307db6d83f4df4964acc992"},{"path":"DEV-04/claims.jsonl","record_count":5,"role":"claims","sha256":"44390852b66dbf0270435b43b36a81ab4bab4ae23317481c3b23117dd0b71db8"},{"path":"DEV-04/coverage_windows.jsonl","record_count":20,"role":"coverage","sha256":"1b47adcaf8d7e7b0d6f815c84f7fe43f2fee2a66b31b0aa7e39f3ece03fbb0d5"},{"path":"DEV-04/deliveries.jsonl","record_count":1,"role":"deliveries","sha256":"967fe59fdd0be97776ab8aac434389f1cd27fabb471f3456a392970cf525b693"},{"path":"DEV-04/delivery_items.jsonl","record_count":1,"role":"delivery_items","sha256":"566e4e344a4456553d5a8c2ad9bac9e5986cefac7fa0920660c7d8228071b7dc"},{"path":"DEV-04/documents.jsonl","record_count":7,"role":"documents","sha256":"5b334d371af758add8866a0dc0f47729a0803160b9a9f0921c6d8a051e1a7af8"},{"path":"DEV-04/event_relations.jsonl","record_count":4,"role":"event_relations","sha256":"b43b135b86f5b8912532d56b74a5d334b2fef90064a8d953c5e57184dcafe799"},{"path":"DEV-04/events.jsonl","record_count":3,"role":"events","sha256":"473e8d580e5e5eb41d0efd5a277314ff912061381c9556fd745ff8a13d3de960"},{"path":"DEV-04/expectations.jsonl","record_count":10,"role":"fixture_expectations","sha256":"ed1c25972efcdaec157289fc5e554d37c9e0cf43b74955ef3cf247d3df403b07"},{"path":"DEV-04/exposures.jsonl","record_count":2,"role":"exposures","sha256":"f0b4982b1aeb674c106e6469f08492da2325f7c531d9f045671b8ed937fb5ff7"},{"path":"DEV-04/families.jsonl","record_count":1,"role":"families","sha256":"daf47eff0740fa2572842837640f40dd082593b6776f58f33843981a3ff1fe6c"},{"path":"DEV-04/personas.jsonl","record_count":1,"role":"personas","sha256":"ee3b9076297f7122a1b528abc3ce70a8ba75e144300c156a2761ea0d589143dd"},{"path":"DEV-04/README.md","record_count":null,"role":"support","sha256":"c8c92a53a98e44adc770901708506ba94ea7a1e5f93aba62f818921b00a571ec"},{"pa